{
  "schema": "nn-builder/graph",
  "version": 1,
  "name": "e33m_plain 30M",
  "description": "MrCogito E33 notebook text model: a page writer makes 32 notes per page; one read layer (+ the next) loops 4 rounds with shared weights. Width 576, 8 layers, FFN 1152.",
  "stacks": [
    {
      "id": "main",
      "name": "Decoder",
      "role": "decoder",
      "width": 576,
      "seq": {
        "kind": "tokens"
      },
      "rows": [
        {
          "id": "main.input",
          "x0_mix": false,
          "cells": [
            {
              "type": "embedding",
              "vocab": 4096,
              "dim": 256,
              "ngram_tables": 0,
              "ngram_buckets": 8192,
              "proj": "gated_mlp",
              "out_norm": "rmsnorm",
              "id": "main.input.emb",
              "label": "token table + input MLP"
            },
            {
              "type": "positional",
              "kind": "rope",
              "theta": 500000,
              "max_len": 4096,
              "id": "main.input.pos"
            }
          ],
          "label": "input"
        },
        {
          "id": "main.L0",
          "x0_mix": true,
          "cells": [
            {
              "type": "attention",
              "mode": "self",
              "heads": 9,
              "head_dim": 64,
              "kv_heads": 1,
              "causal": true,
              "window": 16,
              "qk_norm": true,
              "bias": false,
              "norm": "rmsnorm",
              "kv_norm": "rmsnorm",
              "residual": "pre",
              "memory": false,
              "dual_key": false,
              "nope": false,
              "kernel": "flash",
              "extras": {
                "order_term": false,
                "count_heads": 0,
                "count_max": 10,
                "pos_prior": false,
                "logit_scale": false
              },
              "id": "main.L0.attn"
            },
            {
              "type": "ffn",
              "kind": "swiglu",
              "hidden": 1152,
              "activation": "gelu",
              "bias": false,
              "experts": 1,
              "top_k": 1,
              "norm": "rmsnorm",
              "residual": "pre",
              "id": "main.L0.ffn"
            }
          ],
          "label": "L0"
        },
        {
          "id": "main.L1",
          "x0_mix": true,
          "cells": [
            {
              "type": "attention",
              "mode": "self",
              "heads": 9,
              "head_dim": 64,
              "kv_heads": 1,
              "causal": true,
              "window": 16,
              "qk_norm": true,
              "bias": false,
              "norm": "rmsnorm",
              "kv_norm": "rmsnorm",
              "residual": "pre",
              "memory": false,
              "dual_key": false,
              "nope": false,
              "kernel": "flash",
              "extras": {
                "order_term": false,
                "count_heads": 0,
                "count_max": 10,
                "pos_prior": false,
                "logit_scale": false
              },
              "id": "main.L1.attn"
            },
            {
              "type": "ffn",
              "kind": "swiglu",
              "hidden": 1152,
              "activation": "gelu",
              "bias": false,
              "experts": 1,
              "top_k": 1,
              "norm": "rmsnorm",
              "residual": "pre",
              "id": "main.L1.ffn"
            }
          ],
          "label": "L1"
        },
        {
          "id": "main.L2",
          "x0_mix": true,
          "cells": [
            {
              "type": "attention",
              "mode": "self",
              "heads": 9,
              "head_dim": 64,
              "kv_heads": 1,
              "causal": true,
              "window": 256,
              "qk_norm": true,
              "bias": false,
              "norm": "rmsnorm",
              "kv_norm": "rmsnorm",
              "residual": "pre",
              "memory": true,
              "dual_key": true,
              "nope": false,
              "kernel": "flash",
              "extras": {
                "order_term": true,
                "count_heads": 2,
                "count_max": 10,
                "pos_prior": false,
                "logit_scale": false
              },
              "id": "main.L2.attn"
            },
            {
              "type": "ffn",
              "kind": "swiglu",
              "hidden": 1152,
              "activation": "gelu",
              "bias": false,
              "experts": 1,
              "top_k": 1,
              "norm": "rmsnorm",
              "residual": "pre",
              "id": "main.L2.ffn"
            }
          ],
          "label": "read"
        },
        {
          "id": "main.L3",
          "x0_mix": true,
          "cells": [
            {
              "type": "attention",
              "mode": "self",
              "heads": 9,
              "head_dim": 64,
              "kv_heads": 1,
              "causal": true,
              "window": 16,
              "qk_norm": true,
              "bias": false,
              "norm": "rmsnorm",
              "kv_norm": "rmsnorm",
              "residual": "pre",
              "memory": false,
              "dual_key": false,
              "nope": false,
              "kernel": "flash",
              "extras": {
                "order_term": false,
                "count_heads": 0,
                "count_max": 10,
                "pos_prior": false,
                "logit_scale": false
              },
              "id": "main.L3.attn"
            },
            {
              "type": "ffn",
              "kind": "swiglu",
              "hidden": 1152,
              "activation": "gelu",
              "bias": false,
              "experts": 1,
              "top_k": 1,
              "norm": "rmsnorm",
              "residual": "pre",
              "id": "main.L3.ffn"
            }
          ],
          "label": "L3"
        },
        {
          "id": "main.L4",
          "x0_mix": true,
          "cells": [
            {
              "type": "attention",
              "mode": "self",
              "heads": 9,
              "head_dim": 64,
              "kv_heads": 1,
              "causal": true,
              "window": 16,
              "qk_norm": true,
              "bias": false,
              "norm": "rmsnorm",
              "kv_norm": "rmsnorm",
              "residual": "pre",
              "memory": false,
              "dual_key": false,
              "nope": false,
              "kernel": "flash",
              "extras": {
                "order_term": false,
                "count_heads": 0,
                "count_max": 10,
                "pos_prior": false,
                "logit_scale": false
              },
              "id": "main.L4.attn"
            },
            {
              "type": "ffn",
              "kind": "swiglu",
              "hidden": 1152,
              "activation": "gelu",
              "bias": false,
              "experts": 1,
              "top_k": 1,
              "norm": "rmsnorm",
              "residual": "pre",
              "id": "main.L4.ffn"
            }
          ],
          "label": "L4"
        },
        {
          "id": "main.L5",
          "x0_mix": true,
          "cells": [
            {
              "type": "attention",
              "mode": "self",
              "heads": 9,
              "head_dim": 64,
              "kv_heads": 1,
              "causal": true,
              "window": 16,
              "qk_norm": true,
              "bias": false,
              "norm": "rmsnorm",
              "kv_norm": "rmsnorm",
              "residual": "pre",
              "memory": false,
              "dual_key": false,
              "nope": false,
              "kernel": "flash",
              "extras": {
                "order_term": false,
                "count_heads": 0,
                "count_max": 10,
                "pos_prior": false,
                "logit_scale": false
              },
              "id": "main.L5.attn"
            },
            {
              "type": "ffn",
              "kind": "swiglu",
              "hidden": 1152,
              "activation": "gelu",
              "bias": false,
              "experts": 1,
              "top_k": 1,
              "norm": "rmsnorm",
              "residual": "pre",
              "id": "main.L5.ffn"
            }
          ],
          "label": "L5"
        },
        {
          "id": "main.L6",
          "x0_mix": true,
          "cells": [
            {
              "type": "attention",
              "mode": "self",
              "heads": 9,
              "head_dim": 64,
              "kv_heads": 1,
              "causal": true,
              "window": 16,
              "qk_norm": true,
              "bias": false,
              "norm": "rmsnorm",
              "kv_norm": "rmsnorm",
              "residual": "pre",
              "memory": false,
              "dual_key": false,
              "nope": false,
              "kernel": "flash",
              "extras": {
                "order_term": false,
                "count_heads": 0,
                "count_max": 10,
                "pos_prior": false,
                "logit_scale": false
              },
              "id": "main.L6.attn"
            },
            {
              "type": "ffn",
              "kind": "swiglu",
              "hidden": 1152,
              "activation": "gelu",
              "bias": false,
              "experts": 1,
              "top_k": 1,
              "norm": "rmsnorm",
              "residual": "pre",
              "id": "main.L6.ffn"
            }
          ],
          "label": "L6"
        },
        {
          "id": "main.L7",
          "x0_mix": true,
          "cells": [
            {